id	name sk	question sk	description sk	order sk	koef sk	name cs - vzor	question cs - vzor	description cs - vzor
1	Ochrana údajov	Mali by byť sprísnené spoločné právne predpisy EÚ na ochranu údajov.	Osobné údaje sú napr. údaje o zdravotnom stave, genetické vzorky alebo finančné údaje, informácie o obchodných transakciách alebo o vykonaných telefónických hovoroch a navštívených webových stránkach. Tieto údaje firmy používajú pre svoj ​​biznis alebo ich zhromažďuje polícia či tajné služby.	3	10	Ochrana dat	Měly by být zpřísněny společné právní předpisy EU na ochranu dat.	Osobní data jsou např. data o zdravotním stavu, genetické vzorky nebo finanční údaje, informace o obchodních transakcích nebo o provedených telefonních hovorech a navštívených webových stránkách. Tyto údaje firmy používají pro svůj business nebo je shromažďuje policie či tajné služby.
2	Minimálna mzda	V EÚ by sa mala zaviesť minimálna mzda, naviazaná na priemerný plat v jednotlivých štátoch EÚ.	Minimálna mzda je v EÚ v priemere zhruba 40% priemernej mzdy v danej krajine (najmenej 32% v SR, najviac 50% v Slovinsku a Grécku). V niektorých krajinách (napr. Švédsko) je minimálna mzda stanovená skôr sektorovo a nie celoštátne.	4		Minimální mzda	V EU by se měla zavést minimální mzda navázaná na průměrný plat v jednotlivých státech EU.	Minimální mzda je v EU v průměru zhruba 40 % průměrné mzdy v dané zemi (nejméně 32 % v ČR, nejvíce 50 % ve Slovinsku a Řecku; 37 % na Slovensku). V některých zemích (např. Švédsko) je minimální mzda stanovena spíše sektorově a ne celostátně. 
3	Legislatívna iniciatíva	Európsky parlament by mal mať právomoc iniciovať zákon bez nutnosti oslovenia Európskej komisie.	Európsky parlament na rozdiel od národného parlamentu nemôže predkladať sám nové zákony, len ich schvaľuje. Podľa zástancov posilňovania právomocí, Európsky parlament prispieva k posilňovaniu európskej demokracie a mal by mať väčšie právomoci. Kritici sa však obávajú, že národné parlamenty stratia časť svojich právomocí.			Legislativní iniciativa	Evropský parlament by měl mít pravomoc iniciovat zákon bez nutnosti oslovení Evropské komise.	Evropský parlament, na rozdíl od národního parlamentu, nemůže předkládat sám nové zákony, pouze je schvaluje. Dle zastánců posilování pravomocí Evropský parlament přispívá k posilování evropské demokracie a měl by mít větší pravomoci. Kritici se ale obávají, že národní parlamenty ztratí část svých pravomocí.
4	Emisie CO2	EÚ by mala vymedziť striktnejšie ciele k regulácií CO2.	V EÚ sú zavedené emisné kvóty pre energetické firmy, pomocou ktorých sa limitujú emisie skleníkového plynu CO2 (oxidu uhličitého), čo má zmierniť klimatické problémy. Niektorí ich kritizujú ako nedostatočné, kritici naopak upozorňujú, že takéto regulácie vedú k zvýšeniu cien energií.	7		Emise CO2	EU by měla vymezit striktnější cíle pro regulaci CO2.	V EU jsou zavedeny emisní povolenky pro energetické firmy, pomocí nichž se limitují emise skleníkového plynu CO2 (oxidu uhličitého), což má zmírnit klimatické problémy. Někteří je kritizují jako nedostatečné, kritici naopak upozorňují, že takové regulace vedou ke zvýšení cen energií.
5	Zákaz dotácií jadrovej energetiky	Štáty EÚ by mali mať zakázané dotovať jadrovú energetiku.	Zástancovia jadrovej energetiky poukazujú na vysokú efektivitu pri spaľovaní paliva a na veľmi nízke emisie CO2 oproti inej, napr. uhoľnej či plynovej energii. Kritici upozorňujú, že jadrová energia nie je finančne konkurencieschopná a predstavuje bezpečnostné riziko.	11		Zákaz dotací jaderné energetika 	Státy EU by měly mít zakázáno dotovat jadernou energetiku.	Zastánci jaderné energetiky poukazují na vysokou efektivitu při spalování paliva a na velice nízké emise CO2 oproti jiné, např. uhelné či plynové energii. Kritici upozorňují, že jaderná energie není finančně konkurenceschopná a představuje bezpečnostní riziko.
6	Geneticky upravené plodiny	Malo by byť povolené pestovať geneticky upravené plodiny v celej EÚ.	Zástancovia pestovania geneticky upravených plodín argumentujú, že tieto plodiny zvyšujú výnos,sú odolnejšie voči škodcom a nie je nutné ich toľko chemicky ošetrovať. Odporcovia sa obávajú zdravotných rizík, dopadu na životné prostredie a závislosti na producentoch takýchto plodín.	27		Geneticky upravené plodiny	Mělo by být povoleno pěstovat geneticky upravené plodiny v celé EU.	Zastánci pěstování geneticky upravených plodin argumentují, že tyto plodiny zvyšují výnos a jsou odolnější vůči škůdcům, není nutné je tolik chemicky ošetřovat. Odpůrci se obávají zdravotních rizik, dopadu na životní prostředí a závislosti na producentech takových plodin.
7	Dovozné clá	Dovozné clá na poľnohospodárske produkty z rozvojových krajín by mali byť znížené.	Zástancovia dovozných ciel argumentujú ochranou a podporou ekonomík členských štátov voči ostatným, aby nedošlo k zaplaveniu európskeho trhu lacnými poľnohospodárskymi výrobkami z rozvojových krajín. Kritici upozorňujú, že clá limitujú rozvoj krajín, ktorých významným obchodným artiklom sú práve poľnohospodárske produkty, a tiež, že dražejú potraviny pre zákazníkov v EÚ.			Dovozní cla	Dovozní cla na zemědělské produkty z rozvojových zemí by měla být snížena.	Zastánci dovozních cel argumentují ochranou a podporou ekonomik členských států vůči ostatním, aby nedošlo k zaplavení evropského trhu levnými zemědělskými produkty z rozvojových zemí. Kritici upozorňují, že cla limitují rozvoj zemí, jejichž důležitým obchodním artiklem jsou právě zemědělské produkty, a také, že zdražují potraviny pro zákazníky v EU.
8	Priama voľba predsedu Európskej komisie	Predseda Európskej komisie by mal byť volený v priamých voľbách občanmi EÚ.	Priama voľba predsedu komisie by podľa zástancov mala zvýšiť úroveň demokracie v EÚ a zvýšiť záujem občanov o EÚ. Jej kritici argumentujú, že priama voľba neprináša žiadne riešenie súčasných problémov, ani nezvyšuje dôveryhodnosť EÚ.			Přímá volba předsedy Evropské komise	Předseda Evropské komise by měl být volen v přímých volbách občany EU	Přímá volba předsedy komise by podle zastánců měla zvýšit úroveň demokracie v EU a zvýšit zájem občanů o EU. Její kritici argumentují, že přímá volba nepřináší žádné řešení současných problémů, ani nezvyšuje důvěryhodnost EU.
9	Minimálna sadzba  korporátnej dane	Mala by byť zavedená minimálna sadzba pre dane z príjmov u firiem v celej EÚ.	Daň z príjmov je v krajinách EÚ medzi 10% až 35%. Zástancovia minimálnej sadzby kritizujú existenciu daňových rajov vo vnútri EÚ (napríklad Cyprus), kde môžu firmy platiť dane namiesto platenia daní v krajine, kde zisk reálne vytvorili. Odporcovia upozorňujú na zdravú súťaživosť medzi jednotlivými krajinami.	8		Minimální sazba korporátní daně	Měla by být zavedena minimální sazba pro daně z příjmů u firem v celé EU.	Daně z příjmů je v EU mezi 10 % a 35 %. Zastánci minimální sazby kritizují existenci daňových rájů uvnitř EU (např. Kypr), kde mohou firmy platit daně namísto v zemi, kde zisk reálně vytvořili. Odpůrci upozorňují na zdravou soupeřivost mezi jednotlivými zeměmi. 
10	Nižšia finančná pomoc regiónom	Mala by sa znížiť finančná pomoc ekonomicky slabším regiónom EÚ.	Zhruba 1/3 rozpočtu EÚ ide na regionálnu politiku. Hlavným cieľom je podpora ekonomicky slabších regiónov EÚ, medzi ktoré sa radí celé Slovensko okrem Bratislavy.	28		Nižší finanční pomoc regionům	Měla by se snížit finanční pomoc ekonomicky slabším regionům EU.	Zhruba 1/3 rozpočtu EU jde na regionální politiku. Hlavním cílem je podpora ekonomicky slabších regionů v EU, mezi něž se řadí celé Slovensko mimo Bratislavu.
11	Zastavenie zozširovania EÚ	EÚ by mala zastaviť prijímanie ďalších krajín.	V súčasnej dobe sú oficiálnymi kandidátmi na členstvo Čierna Hora, Island, Macedónsko, Srbsko a Turecko.	29		Zastavení rozšiřování EU	EU by měla zastavit přijímání dalších zemí.	V současné době jsou oficiálními kandidáty na členství Černá Hora, Island, Makedonie, Srbsko a Turecko. 
12	Daň z finančných transakcií	EÚ by mala zaviesť daň z finančných transakcií ("tzv. Tobinovu daň")	Podľa zástancov by daň z finančných transakcií (tzv. "Tobinova daň", približne 0.01% - 0.1%) mala zabráňovať finančným špekuláciám. Kritici argumentujú, že takéto opatrenie by muselo byť zavedené celosvetovo, inak by viedlo k veľkému presunu firiem za hranice EÚ.	13		Daň z finančních transakcí	EU by měla zavést daň z finančních transakcí ("tzv. Tobinovu daň")	Podle zastánců by daň z finančních transakcí (tzv. "Tobinova daň", zhruba 0.01%-0.1%) měla zabraňovat finančním spekulacím. Kritici argumentují, že takové opatření by muselo být zavedeno celosvětově, jinak by vedlo k velkému přesunu firem za hranice EU. 
13	Európska armáda	EÚ by mala mať vlastnú armádu.	V súčasnej dobe EÚ nemá, okrem výnimiek ako bojové skupiny, vlastnú armádu. Podľa zástancov by existencia spoločnej armády zvýšila postavenie EÚ na medzinárodnej scéne a prispela k riešeniu konfliktov. Podľa kritikov by obrana mala ostať iba v rukách členských štátov.	18		Evropská armáda	EU by měla mít vlastní armádu.	V současné době EU nemá, krom výjimek jako bitevní skupiny, vlastní armádu. Podle zastánců by existence společné armády zvýšilo postavení EU na mezinárodní scéně a přispělo k řešení konfliktů. Podle kritiků by obrana měla zůstat pouze v rukou členských států.
14	Odvolateľnosť komisárov	Európsky parlament by mal mať možnosť odvolať jednotlivých európskych komisárov.	Komisári sú do svojej funkcie navrhovaní členskými štátmi. Komisia ("európska vláda") ako celok je schválená Európskym parlamentom. Jediný spôsob, akým môže byť celá komisia odvolaná, je vyhlásenie nedôvery Európskym parlamentom s dvoma tretinami hlasov jeho poslancov. Odvolať jednotlivých komisárov parlament nemôže.			Odvolatelnost komisařů	Evropský parlament by měl mít možnost odvolat jednotlivé evropské komisaře	Komisaři jsou do své funkce navrhováni členskými státy. Komise ("evropská vláda") jako celek je schválena Evropským parlamentem. Jediný způsob, jakým může být celá komise odvolána, je vyhlášení nedůvěry Evropským parlamentem, s dvěma třetinami hlasů jeho poslanců. Odvolat jednotlivého komisaře parlament nemůže.
15	Zahraničná politika EÚ	Viac oblastí zahraničnej politiky by malo byť rozhodovaných na úrovni EÚ.	EÚ si dala možnosť vykonávať spoločnú zahraničnú a bezpečnostnú politiku ale táto možnosť sa využíva iba obmedzene. Pre členské štáty sú ciele síce záväzné ale európske právo nemá žiadne sankcie za ich porušenie.	20		Zahraniční politika EU	Více oblastí zahraniční politiky by mělo být rozhodováno na úrovni EU.	EU si dala možnost provádět společnou zahraniční a bezpečnostní politiku, ale tato možnost se využívá jen omezeně. Pro členské státy jsou cíle sice závazné, ale evropské právo nemá žádné sankce za porušení.
16	Rozvojová pomoc EÚ	EÚ by mala zvýšiť prostriedky na zahraničnú pomoc.	EÚ je najväčším svetovým poskytovateľom rozvojovej pomoci. Podľa zástancov rozvojová pomoc pomáha v cieľových krajinách a zabraňuje tak okrem iného populačnej explózii a znižuje emigráciu do bohatších krajín, napr krajín EÚ. Podľa odporcov je podstatná časť rozkradnutá vládnymi vrstvami a zločineckými štruktúrami a nedostane sa tak k tým, ktorým je určená.	14	-9	Rozvojová pomoc EU	EU by měla zvýšit prostředky na zahraniční pomoc.	EU je největším světovým poskytovatelem rozvojové pomoci. Podle zastánců rozvojová pomoc pomáhá v cílových zemích a zabraňuje tak mj. populační explozi a snižuje emigraci do bohatších zemí, např. zemí EU. Podle odpůrců podstatná část je rozkradena vládními vrstvami a zločineckými strukturami a nedostane se tak k těm, kterým je určena.
17	Spoločné európske dlhopisy	Mali by byť zavedené spoločné európske dlhopisy pre krajiny eurozóny.	Prostredníctvom spoločných európskych dlhopisov (eurobondov) by investori požičiavali financie eurozóne ako celku. Eurobondy majú pomôcť riešiť dlhovú krízu znížením nákladov úverov pre krajiny ako Grécko alebo Portugalsko, čo by pomohlo im aj celej eurozóne. Kritici upozorňujú na morálny hazard, jednotlivé krajiny by niesli nižšie riziko a mohli sa správať nezodpovedne.	9		Společné evropské dluhopisy	Měly by být zavedeny společné evropské dluhopisy pro země eurozóny.	Pomocí společných evropských dluhopisů (eurobondů) by investoři půjčovali finance eurozóně jako celku. Eurobondy mají pomoci řešit dluhovou krizi snížením nákladů úvěrů pro země jako Řecko nebo Portugalsko, což by pomohlo jim i celé eurozóně. Kritici upozorňují na morální hazard, jednotlivé země by nesly nižší riziko a mohly se chovat nezodpovědně.
18	Sobáše osôb rovnakého pohlavia	Členské štáty musia uznať sobáše osôb ronakého pohlavia, ktoré sú uzavreté v inej členskej krajine EÚ.	Európsky súd pre ľudské práva v roku 2010 rozhodol, že registrované partnerstvo nie je ľudským právom a zmluvné štáty nie sú povinné ho umožňovať uzavrieť a uznávať. Zástancovia požadujú rovnaké práva pre homosexuálne dvojice v celej EÚ. Odporcovia odmietajú uznať registrované partnerstvo napr. z náboženských dôvodov.	21		Sňatky osob stejného pohlaví 	Členské státy musí uznat sňatky osob stejného pohlaví, které jsou uzavřeny v jiné členské zemi EU.	Evropský soud pro lidská práva v roce 2010 rozhodl, že registrované partnerství není lidským právem a smluvní státy nemají povinnost jej umožňovat uzavřít a uznávat. Zastánci požadují stejná práva pro homosexuální dvojice v celé EU. Odpůrci odmítají uznávat registrované partnerství např. z náboženských důvodů.
19	Azylové zákony	Podmienky pre udelenie azylu by mali byť rovnaké vo všetkých členských štátoch EÚ.	Podľa zástancov by zjednotenie podmienok pre udelenie azylu zamedzilo "prelievanie" ľudí, hľadajúcich azyl, z jednej krajiny EÚ do inej. Odporcovia naopak argumentujú, že situácia sa v jednotlivých štátoch líši, preto by regulácia udeľovania azylu mala zostať na národnej úrovni.	22		Azylové zákony	Podmínky pro udělení azylu by měly být stejné ve všech členských státech EU	Podle zastánců by sjednocení podmínek pro udělení azylu zamezilo "přelévání" lidí, hledajících azyl, z jedné země EU do jiné. Odpůrci naopak argumentují, že situace se liší v jednotlivých státech, proto by regulace udělování azylu měla zůstat na národní úrovni.
20	Európske dane	EÚ by mala vyberať európske dane, ktoré by nahradili existujúce príspevky členských štátov.	V súčasnosti väčšina príjmov EÚ pochádza z príspevkov jednotlivých krajín na základe výšky ich hrubého národného produktu. Zavedením európskej dane by sa zvýšila nezávislosť rozpočtu EÚ na členských krajinách.	24		Evropské daně	EU by měla vybírat evropské daně, které by nahradily existující příspěvky členských států.	V současné době většina příjmů EU pochází z příspěvků jednotlivých zemí na základě výše jejich hrubého národního produktu. Zavedením evropské daně by se zvýšila nezávislost rozpočtu EU na členských zemích.
22	Federalizácia EÚ	EÚ by sa mala stať federáciou.	Štátna moc je vo federácii rozložená medzi federálne orgány a orgány členských krajín, čo je zaistené ústavou. Federáciou sú napr USA, Rusko, Brazília alebo India. Naopak ale arabské alebo latinsko-americkej krajiny sú samostatné, aj napriek tomu že sa tam hovorí jedným jazykom.	30		Federalizace EU	EU by se měla stát federací.	Státní moc je ve federaci rozložena mezi federální orgány a orgány členských zemí, což je zajištěno ústavou. Federací jsou např. USA, Rusko, Brazílie nebo Indie. Naopak ale arabské nebo latinsko-americké země jsou samostatné, i přesto že se tam mluví jedním jazykem. 
23	Komisie podľa volieb	Zloženie Európskej komisie by malo zodpovedať výsledkom eurovolieb.	Do Európskej komisie ("európskej vlády") jej komisára teraz nominujú vlády členských krajín EÚ. Komisia teda nezodpovedá výsledkom eurovolieb, napr je v nej jeden nutne jeden komisár z každej krajiny (z najväčšieho Nemecka aj z najmenšej Malty).	2		Komise dle voleb	Složení Evropské komise by mělo odpovídat výsledkům eurovoleb.	Do Evropské komise ("evropské vlády") její komisaře nyní nominují vlády členských zemí EU. Komise tedy neodpovídá výsledkům eurovoleb, např. je v ní jeden nutně jeden komisař z každé země (z největšího Německa i z nejmenší Malty). 
24	Európske referendum	Mala by byť možnosť vypísania celoeurópskeho referenda na základe petície.	Slovenský občan môže vyvolať referendum na miestnej, krajskej a celoštátnej úrovni, ale nie na celoeurópskej. Podľa zástancov by zavedenie európskeho referenda zvýšilo možnosť občanov rozhodovať, podľa odporcov by bolo nákladné a mohlo by viesť k prijímaniu populistických opatrení.	10		Evropské referendum	Měla by být možnost vypsání celoevropského referenda na základě petice. 	Slovenský občan může vyvolat referendum na místní a krajské úrovni, nikoli na celostátní nebo celoevropské. Podle zastánců by zavedení evropského referenda zvýšilo možnost občanů rozhodovat, podle odpůrců by bylo nákladné a mohlo by vést k přijímání populistických opatření.
25	Zrušenie letného času	Letný čas by mal byť zrušený.	Letný čas sa používa, pretože mnoho aktivít v spoločnosti sa riadi hodinami a nemení sa v priebehu roka (školy, zamestnania), hoci čas denného svetla sa mení. Pôvodne bol zavedený s cieľom šetriť energiu, hoci teraz je už tento efekt minimálny. Letný čas je zavádzaný po celej Európe, prvýkrát na svete v Rakúsko-Uhorsku v roku 1916.			Zrušení letního času 	Letní čas by měl být zrušen.	Letní čas se používá, neboť mnoho aktivit ve společnosti se řídí hodinami a nemění se v průběhu roku (školy, zaměstnání), ač čas denního světla se mění. Původně byl zaveden s cílem šetřit energii, ačkoli nyní je již tento efekt minimální. Letní čas je zaváděn po celé Evropě, poprvé na světě v Rakousku-Uhersku 1916.
26	Euro-záruka na tovar	Tovar zakúpený v EÚ by malo byť možné reklamovať u rovnakej firmy v akejkoľvek krajine EÚ.	Obyčajne nemožno reklamovať tovar u pobočky rovnakej firmy v inej krajine EÚ. Napr. v rámci Slovenska, to ale zo zákona možné je.	23	11	Euro-záruka na zboží	Zboží zakoupené v EU by měĺo být možné reklamovat u stejné firmy v jakékoliv zemi EU	Reklamovat zboží obecně nelze u pobočky stejné firmy v jiné zemi EU. Např. v rámci Slovenska to ale ze zákona možné je. 
27	Euro-živnosť	Živnostenský list by mal stačiť na výkon daného remesla či podnikania po celej EÚ.	V súčasnej dobe nie je možné na základe napr. slovenského živnostenského listu dlhodobo podnikať v ČR. Ale rovnaký živnostenský list platí po celej Slovenskej republike.		11	Euro-živnost	Živnostenský list by měl stačit k výkonu daného řemesla či podnikání po celé EU. 	V současné době nelze např. na základě slovenského živnostenského listu dlouhodobě podnikat v ČR. Ale stejný živnostenský list platí po celé Slovensko. 
28	Erasmus na stredných školách	Erasmus by mal byť rozšírený aj na stredné školy.	Program Erasmus podporuje študentov vysokých škôl, aby časť štúdia prebehla v inej krajine EÚ. Náklady na Erasmus z rozpočtu EÚ sú teraz zhruba 2 miliardy eur ročne.	25	12	Erasmus na středních školách	Erasmus by měl být rozšířen i na střední školy.	Program Erasmus podporuje studenty vysokých škol, aby část studia proběhla v jiné zemi EU. Náklady Erasmu z rozpočtu EU jsou nyní zhruba 2 miliardy eur ročně.
29	Rovnaké sadzby DPH	Sadzby DPH by mali byť zjednotené v celej EÚ.	Výška dane z pridanej hodnoty je v právomoci členských krajín a je rôzna v ​​celej EÚ, základná sadzba od 15 do 27%, ale napr. u potravín je to medzi 0 a 27%. Tieto rozdiely niektorých obchodníkov zvýhodňujú a iných znevýhodňujú.			Stejné sazby DPH 	Sazby DPH by měly být sjednocené v celé EU.	Výše daně z přidané hodnoty je v pravomoci členských zemí a je různá v celé EU, základní sazba od 15 do 27 %, např. u potravin potom mezi 0 a 27 %. Tyto rozdíly některé obchodníky zvýhodňují a jiné znevýhodňují.
30	Registrácia auta	Registrácia auta by mala platiť v celej EÚ.	Teraz je nutné pre auto kúpené v inej krajine EÚ zariadiť špeciálne "prevozné číslo", krátkodobé povinné ručenie a po dovoze ho preregistrovať. Staršie autá nemožno v inej krajine EÚ kupovať vôbec.		13	Registrace auta	Registrace auta by měla platit po celé EU. 	Nyní je nutné pro auto koupené v jiné zemi EU zařídit speciální "převozní číslo", krátkodobé povinné ručení a po dovozu ho přeregistrovat. Starší auta nelze v jiné zemi EU kupovat vůbec. 
31	Dohoda EÚ-USA	Zmluva o "Transatlantickom partnerstve pre obchod a investície" (TTIP) medzi EÚ a USA by mala byť schválená.	Zástancovia dohody argumentujú, že posilní ekonomiku EÚ. Kritici varujú, že EÚ ani jej členské štáty nebudú môcť napr. účinne regulovať ťažbu bridlicového plynu, pestovanie geneticky upravených plodín alebo finančnú sféru.	12		Dohoda EU-USA	Smlouva o "Transatlantickém partnerství pro obchod a investice" (TTIP) mezi EU a USA by měla být schválena.	Zastánci dohody argumentují, že posílí ekonomiku EU. Kritici varují, že EU ani její členské státy nebudou moci např. účinně regulovat těžbu břidlicového plynu, pěstování geneticky upravených plodin nebo finanční sféru.
32	Diaľničná známka	Mala by existovať špeciálna diaľničná známka (alebo podobný systém) platná v celej EÚ.	V súčasnej dobe v 7 krajinách EÚ existujú diaľničné známky a v ďalších 10 sa platí mýto. Naopak povinné ručenie - "zelená karta" - platí po celej EÚ.	6		Dálniční známka 	Měla by existovat speciální dálniční známka (nebo podobný systém) platná v celé EU 	V současné době v 7 zemích EU existují dálniční známky a v dalších 10 se platí mýtné. Naopak povinné ručení - "zelená karta" - platí po celé EU. 
33	Žiarovky	Predaj žiaroviek nad 60W by mal byť opäť povolený.	Nariadenie EÚ zakazuje predaj žiaroviek nad 60W. Bolo zavedené z dôvodu obmedzenia plytvania energiou. Podobné platí napr. aj vo Švajčiarsku, Rusku, Austrálii, Kanade alebo Brazílii. Oponenti argumentujú, že alternatívy k žiarovke sú drahšie a nehodia sa na všetky použitia.	15		Žárovky	Prodej žárovek nad 60W by měl být opět povolen.	Nařízení EU zakazuje prodej žárovek nad 60W. Bylo zavedeno z důvodu omezení plýtvání energií. Podobné platí např. i ve Švýcarsku, Rusku, Austrálii, Kanadě nebo Brazílii. Oponenti argumentují, že alternativy k žárovce jsou dražší a nehodí se na všechna použití. 
34	Polícia EÚ	Polícia EÚ by sa mala zväčšiť.	V súčasnej dobe na úrovni EÚ pôsobí len Europol s menej než 1000 zamestnancami. Podľa zástancov by zväčšenie tejto inštitúcie zvýšilo bezpečnosť, podľa odporcov by polícia mala zostať v právomoci členských štátov.	16		Policie EU	Měla by se zvětšit policie EU. 	V současné době na úrovni EU působí jen Europol s méně než 1000 zaměstnanců. Podle zastánců by zvětšení této instituce zvýšilo bezpečnost, podle odpůrců by policie měla zůstat v pravomoci členských států.
35	Nižšie dotácie pre poľnohospodárstvo 	Dotovanie poľnohospodárov z peňazí EÚ by sa malo znížiť.	Viac ako 1/3 rozpočtu EÚ ide na podporu poľnohospodárstva, z najväčšej časti na priame dotácie poľnohospodárom. Podľa zástancov podpora poľnohospodárstva zvyšuje sebestačnosť EÚ oproti dovozu potravín z krajín mimo EÚ a zvyšuje životnú úroveň na vidieku. Podľa odporcov je príliš nákladná a zvyšuje ceny pre zákazníkov.	5		Nižší dotace pro zemědělství	Dotování zemědělců z peněz EU by se mělo snížit.	Více jak 1/3 rozpočtu EU jde na podporu zemědělství, z největší části na přímé dotace zemědělcům. Podle zastánců podpora zemědělství zvyšuje soběstačnost EU oproti dovozu potravin ze zemí mimo EU a zvyšuje životní úroveň na venkově. Podle odpůrců je příliš nákladná a zvyšuje ceny pro zákazníky.
