id	name sk	question sk	description sk	order sk	koef sk	name cs - vzor	question cs - vzor	description cs - vzor
36	Dáta o cestujúcich do USA	Letecké spoločnosti by mali ďalej posielať údaje o cestujúcich do USA.	Letecké spoločnosti sú teraz nútené posielať všetky údaje o cestujúcich do USA tamojšiemu ministerstvu vnútornej bezpečnosti, ktoré ich podľa dohody s EÚ legálne ukladá na 10 rokov. Zástancovia obhajujú tieto opatrenia bojom proti terorizmu. Oponenti poukazujú na slabú ochranu týchto dát proti zneužitiu.		-10	Data o cestujících do USA	Letecké společnosti by měly dále posílat data o cestujících do USA.	Letecké společnosti jsou nyní nuceny posílat veškeré údaje o cestujících do USA tamnímu Ministerstvu vnitřní bezpečnosti, které je dle dohody s EU legálně ukládá na 10 let. Zastánci obhajují opatření bojem proti terorismu. Oponenti ukazují na slabou ochranu těchto dat proti zneužití.
37	Dĺžka copyrightu	Lehota ochrany autorských diel by sa mala v EÚ skrátiť.	Autorské diela ako knihy alebo filmy sú v EÚ chránená po dobu 70 rokov od úmrtia autora, hudba po dobu 50 rokov. Obhajcovia argumentujú tým, že bez takejto ochrany, by niektoré diela ani nevznikli. Kritici upozorňujú, že takto dlhá ochrana obmedzuje tvorbu odvodených diel, a že táto ochrana pôvodne fungovala len ako ochrana autora pred vydavateľom, nie pre nekomerčné využitie.	17		Délka copyrightu	Doba ochrany autorských děl by se měla v EU zkrátit.	Autorská díla jako knihy nebo filmy jsou v EU chráněna po dobu 70 let od úmrtí autora, hudba po dobu 50 let. Obhájci argumentují tím, že bez takové ochrany by některá díla ani nevznikla. Kritici upozorňují, že takto dlouhá ochrana omezuje tvorbu odvozených děl a že tato ochrana původně fungovala jen jako ochrana autora před vydavatelem, nikoliv pro nekomerční využití. 
38	Obmedzenia voľného pohybu pracovníkov	Krajiny EÚ by mali mať možnosť obmedziť zamestnávanie občanov z iných krajín EÚ.	Voľný pohyb zamestnancov (možnosť byť zamestnaný v akejkoľvek krajine EÚ) je jednou zo základných slobôd v EÚ. Kritici argumentujú napr. zneužívaním sociálneho systému cieľovej krajiny. Obhajcovia ukazujú, že krajina, kde ľudia z iných krajín pracujú, na tom celkovo ekonomicky zarába.			Omezení volného pohybu pracovníků	Země EU by měly mít možnost omezit zaměstnávání občanů z jiných zemí EU. 	Volný pohyb zaměstnanců (možnost být zaměstnán v jakékoliv zemi EU) je jednou ze základních svobod v EU. Kritici argumentují např. zneužíváním sociálního systému cílové země. Obhájci ukazují, že země, kde lidé z jiných zemí pracují, na tom celkově ekonomicky vydělává.
40	Tuzemský rum a nátierkové maslo	EÚ by mala prestať určovať podrobné normy pre potraviny.	V EÚ existujú normy, ktoré okrem iného vyhradzujú predajné označenie 'maslo' pre produkty obsahujúce aspoň 80% mliečneho tuku, odtiaľ pochádza povinnosť stiahnuť názov 'nátierkové maslo', ktoré obsahuje tuku výrazne menej. Podobne 'rum' musí obsahovať alkohol z cukrovej trstiny, čomu tak nie je v prípade 'tuzemského rumu'.	26		Tuzemský rum a pomazánkové máslo 	EU by měla přestat určovat podrobné normy pro potraviny.	V EU existují normy, které mj. vyhrazují prodejní označení 'máslo' pro produkty obsahující alespoň 80 % mléčného tuku, odtud povinnost stáhnout název 'pomazánkové máslo', které obsahuje tuku výrazně méně. Podobně 'rum' musí obsahovat alkohol z cukrové třtiny, čemuž tak není v případě 'tuzemského rumu'. 
42	Slovenská koruna	Slovenská republika by sa malo vrátiť ku slovenskej korune.	Eurom sa platí v 18 krajinách EÚ a niekoľkých ďalších mimo EÚ. Zo susedných krajín sa používa euro len v Rakúsku. V Českej republike, v Poľsku, v Maďarsku a na Ukrajine nie. Členské štáty sa vstupom do EÚ zaviazali k prijatiu Eura. Podľa zástancov je používanie Eura ekonomicky výhodné, podľa odporcov tomu tak nie je.	19	-10	Slovenská koruna	Slovensko by se mělo vrátit ke Slovenské koruně.	Eurem se platí v 18 zemích EU a několika dalších mimo EU. Ze sousedních zemí se Euro používá jen v Rakousku, v České republice, v Polsku, v Maďarsku a na Ukrajině ne. Členské státy se vstupem do EU zavázaly k přijetí Eura. Podle zastánců je používání Eura ekonomicky výhodné, podle odpůrců tomu tak není.
43	Vystúpenie z EÚ	Slovensko by malo vystúpiť z EÚ.	Európsku úniu tvorí 28 krajín. Mimo EÚ je v Európe napríklad Ukrajina, Bielorusko, Švajčiarsko alebo Nórsko.	1	-10	Vystoupení z EU	Slovensko by mělo vystoupit z EU.	Evropskou unii tvoří 28 zemí, mj. všechny sousední země. Mimo EU je v Evropě např. Ukrajina, Bělorusko, Švýcarsko nebo Norsko.